,Text
104,"similarity learningis an area of supervised machine learning closely related to regression and classification, but the goal is to learn from examples using a similarity function that measures how similar or related two objects are."
105,"it has applications inranking,recommendation systems, visual identity tracking, face verification, and speaker verification.unsupervised learningmain article:unsupervised learningsee also:cluster analysisunsupervised learning algorithms find structures in data that has not been labelled, classified or categorised."
106,"instead of responding to feedback, unsupervised learning algorithms identify commonalities in the data and react based on the presence or absence of such commonalities in each new piece of data."
107,"central applications of unsupervised machine learning include clustering,dimensionality reduction,anddensity estimation."
108,"cluster analysis is the assignment of a set of observations into subsets (calledclusters) so that observations within the same cluster are similar according to one or more predesignated criteria, while observations drawn from different clusters are dissimilar."
109,"different clustering techniques make different assumptions on the structure of the data, often defined by somesimilarity metricand evaluated, for example, byinternal compactness, or the similarity between members of the same cluster, andseparation, the difference between clusters."
110,"other methods are based onestimated densityandgraph connectivity.a special type of unsupervised learning called,self-supervised learninginvolves training a model by generating the supervisory signal from the data itself."
111,dimensionality reductiondimensionality reductionis a process of reducing the number of random variables under consideration by obtaining a set of principal variables.
112,"in other words, it is a process of reducing the dimension of thefeatureset, also called the ""number of features""."
113,most of the dimensionality reduction techniques can be considered as either feature elimination orextraction.
114,one of the popular methods of dimensionality reduction isprincipal component analysis(pca).
115,"pca involves changing higher-dimensional data (e.g., 3d) to a smaller space (e.g., 2d)."
116,"themanifold hypothesisproposes that high-dimensional data sets lie along low-dimensionalmanifolds, and many dimensionality reduction techniques make this assumption, leading to the areas ofmanifold learningandmanifold regularisation.semi-supervised learningmain article:semi-supervised learningsemi-supervised learning falls betweenunsupervised learning(without any labelled training data) andsupervised learning(with completely labelled training data)."
117,"some of the training examples are missing training labels, yet many machine-learning researchers have found that unlabelled data, when used in conjunction with a small amount of labelled data, can produce a considerable improvement in learning accuracy.inweakly supervised learning, the training labels are noisy, limited, or imprecise; however, these labels are often cheaper to obtain, resulting in larger effective training sets."
118,"reinforcement learningmain article:reinforcement learningin reinforcement learning, an agent takes actions in an environment: these produce a reward and/or a representation of the state, which is fed back to the agent.reinforcement learning is an area of machine learning concerned with howsoftware agentsought to takeactionsin an environment to maximise some notion of cumulative reward."
119,"due to its generality, the field is studied in many other disciplines, such asgame theory,control theory,operations research,information theory,simulation-based optimisation,multi-agent systems,swarm intelligence,statisticsandgenetic algorithms."
120,"in reinforcement learning, the environment is typically represented as amarkov decision process(mdp)."
121,many reinforcement learning algorithms usedynamic programmingtechniques.
122,reinforcement learning algorithms do not assume knowledge of an exact mathematical model of the mdp and are used when exact models are infeasible.
123,"reinforcement learning algorithms are used in autonomous vehicles or in learning to play a game against a human opponent.other typesother approaches have been developed which do not fit neatly into this three-fold categorisation, and sometimes more than one is used by the same machine learning system."
124,"for example,topic modelling,meta-learning."
125,"self-learningself-learning, as a machine learning paradigm, was introduced in 1982 along with a neural network capable of self-learning, namedcrossbar adaptive array(caa)."
126,"it gives a solution to the problem learning without any external reward, by introducing emotion as an internal reward."
127,emotion is used as a state evaluation of a self-learning agent.
128,"the caa self-learning algorithm computes, in a crossbar fashion, both decisions about actions and emotions (feelings) about consequence situations."
129,the system is driven by the interaction between cognition and emotion.
130,"the self-learning algorithm updates a memory matrix w =||w(a,s)|| such that in each iteration executes the following machine learning routine:in situationsactareceive a consequence situations'compute emotion of being in the consequence situationv(s')update crossbar memoryw'(a,s) = w(a,s) + v(s')it is a system with only one input, situation, and only one output, action (or behaviour) a."
131,there is neither a separate reinforcement input nor an advice input from the environment.
132,the backpropagated value (secondary reinforcement) is the emotion toward the consequence situation.
133,"the caa exists in two environments, one is the behavioural environment where it behaves, and the other is the genetic environment, wherefrom it initially and only once receives initial emotions about situations to be encountered in the behavioural environment."
134,"after receiving the genome (species) vector from the genetic environment, the caa learns a goal-seeking behaviour in an environment that contains both desirable and undesirable situations."
135,feature learningmain article:feature learningseveral learning algorithms aim at discovering better representations of the inputs provided during training.
136,classic examples includeprincipal component analysisand cluster analysis.
137,"feature learning algorithms, also called representation learning algorithms, often attempt to preserve the information in their input but also transform it in a way that makes it useful, often as a pre-processing step before performing classification or predictions."
138,"this technique allows reconstruction of the inputs coming from the unknown data-generating distribution, while not being necessarily faithful to configurations that are implausible under that distribution."
139,"this replaces manualfeature engineering, and allows a machine to both learn the features and use them to perform a specific task.feature learning can be either supervised or unsupervised."
140,"in supervised feature learning, features are learned using labelled input data."
141,"examples includeartificial neural networks,multilayer perceptrons, and superviseddictionary learning."
142,"in unsupervised feature learning, features are learned with unlabelled input data."
143,"examples include dictionary learning,independent component analysis,autoencoders,matrix factorisationand various forms ofclustering."
144,"manifold learningalgorithms attempt to do so under the constraint that the learned representation is low-dimensional.sparse codingalgorithms attempt to do so under the constraint that the learned representation is sparse, meaning that the mathematical model has many zeros.multilinear subspace learningalgorithms aim to learn low-dimensional representations directly fromtensorrepresentations for multidimensional data, without reshaping them into higher-dimensional vectors."
145,"deep learningalgorithms discover multiple levels of representation, or a hierarchy of features, with higher-level, more abstract features defined in terms of (or generating) lower-level features."
146,it has been argued that an intelligent machine learns a representation that disentangles the underlying factors of variation that explain the observed data.
147,feature learning is motivated by the fact that machine learning tasks such as classification often require input that is mathematically and computationally convenient to process.
148,"however, real-world data such as images, video, and sensory data have not yielded attempts to algorithmically define specific features."
149,"an alternative is to discover such features or representations through examination, without relying on explicit algorithms.sparse dictionary learningmain article:sparse dictionary learningsparse dictionary learning is a feature learning method where a training example is represented as a linear combination ofbasis functionsand assumed to be asparse matrix."
150,the method isstrongly np-hardand difficult to solve approximately.
151,a popularheuristicmethod for sparse dictionary learning is thek-svdalgorithm.
152,sparse dictionary learning has been applied in several contexts.
153,"in classification, the problem is to determine the class to which a previously unseen training example belongs."
154,"for a dictionary where each class has already been built, a new training example is associated with the class that is best sparsely represented by the corresponding dictionary."
155,sparse dictionary learning has also been applied inimage denoising.
156,"the key idea is that a clean image patch can be sparsely represented by an image dictionary, but the noise cannot."
157,"anomaly detectionmain article:anomaly detectionindata mining, anomaly detection, also known as outlier detection, is the identification of rare items, events or observations that raise suspicions by differing significantly from the majority of the data."
158,"typically, the anomalous items represent an issue such asbank fraud, a structural defect, medical problems or errors in a text."
159,"anomalies are referred to asoutliers, novelties, noise, deviations and exceptions."
160,"in particular, in the context of abuse and network intrusion detection, the interesting objects are often not rare, but unexpected bursts of inactivity."
161,this pattern does not adhere to the common statistical definition of an outlier as a rare object.
162,"many outlier detection methods (in particular, unsupervised algorithms) will fail on such data unless aggregated appropriately."
163,"instead, a cluster analysis algorithm may be able to detect the micro-clusters formed by these patterns."
164,three broad categories of anomaly detection techniques exist.
165,"unsupervised anomaly detection techniques detect anomalies in an unlabelled test data set under the assumption that the majority of the instances in the data set are normal, by looking for instances that seem to fit the least to the remainder of the data set."
166,"supervised anomaly detection techniques require a data set that has been labelled as ""normal"" and ""abnormal"" and involves training a classifier (the key difference from many other statistical classification problems is the inherently unbalanced nature of outlier detection)."
167,"semi-supervised anomaly detection techniques construct a model representing normal behaviour from a given normal training data set and then test the likelihood of a test instance being generated by the model.robot learningrobot learningis inspired by a multitude of machine learning methods, starting from supervised learning, reinforcement learning,and finallymeta-learning(e.g."
168,maml).association rulesmain article:association rule learningsee also:inductive logic programmingassociation rule learning is arule-based machine learningmethod for discovering relationships between variables in large databases.
169,"it is intended to identify strong rules discovered in databases using some measure of ""interestingness""."
170,"rule-based machine learning is a general term for any machine learning method that identifies, learns, or evolves ""rules"" to store, manipulate or apply knowledge."
171,the defining characteristic of a rule-based machine learning algorithm is the identification and utilisation of a set of relational rules that collectively represent the knowledge captured by the system.
172,this is in contrast to other machine learning algorithms that commonly identify a singular model that can be universally applied to any instance in order to make a prediction.
173,"rule-based machine learning approaches includelearning classifier systems, association rule learning, andartificial immune systems.based on the concept of strong rules,rakesh agrawal,tomasz imielińskiand arun swami introduced association rules for discovering regularities between products in large-scale transaction data recorded bypoint-of-sale(pos) systems in supermarkets."
174,"for example, the rule{onions,potatoes}⇒{burger}{\displaystyle \{\mathrm {onions,potatoes} \}\rightarrow \{\mathrm {burger} \}}found in the sales data of a supermarket would indicate that if a customer buys onions and potatoes together, they are likely to also buy hamburger meat."
175,such information can be used as the basis for decisions about marketing activities such as promotionalpricingorproduct placements.
176,"in addition tomarket basket analysis, association rules are employed today in application areas includingweb usage mining,intrusion detection,continuous production, andbioinformatics."
177,"in contrast withsequence mining, association rule learning typically does not consider the order of items either within a transaction or across transactions.learning classifier systems(lcs) are a family of rule-based machine learning algorithms that combine a discovery component, typically agenetic algorithm, with a learning component, performing eithersupervised learning,reinforcement learning, orunsupervised learning."
178,they seek to identify a set of context-dependent rules that collectively store and apply knowledge in apiecewisemanner to make predictions.
179,"inductive logic programming(ilp) is an approach to rule learning usinglogic programmingas a uniform representation for input examples, background knowledge, and hypotheses."
180,"given an encoding of the known background knowledge and a set of examples represented as a logical database of facts, an ilp system will derive a hypothesized logic program thatentailsall positive and no negative examples.inductive programmingis a related field that considers any kind of programming language for representing hypotheses (and not only logic programming), such asfunctional programs.inductive logic programming is particularly useful inbioinformaticsandnatural language processing.gordon plotkinandehud shapirolaid the initial theoretical foundation for inductive machine learning in a logical setting."
181,shapiro built their first implementation (model inference system) in 1981: aprologprogram that inductively inferred logic programs from positive and negative examples.
182,"the terminductivehere refers tophilosophicalinduction, suggesting a theory to explain observed facts, rather thanmathematical induction, proving a property for all members of a well-ordered set.modelsamachine learning modelis a type ofmathematical modelthat, once ""trained"" on a given dataset, can be used to make predictions or classifications on new data."
183,"during training, a learning algorithm iteratively adjusts the model's internal parameters to minimise errors in its predictions."
184,"by extension, the term ""model"" can refer to several levels of specificity, from a general class of models and their associated learning algorithms to a fully trained model with all its internal parameters tuned."
185,"various types of models have been used and researched for machine learning systems, picking the best model for a task is calledmodel selection.artificial neural networksmain article:artificial neural networksee also:deep learningan artificial neural network is an interconnected group of nodes, akin to the vast network ofneuronsin abrain."
186,"here, each circular node represents anartificial neuronand an arrow represents a connection from the output of one artificial neuron to the input of another.artificial neural networks (anns), orconnectionistsystems, are computing systems vaguely inspired by thebiological neural networksthat constitute animalbrains."
187,"such systems ""learn"" to perform tasks by considering examples, generally without being programmed with any task-specific rules.an ann is a model based on a collection of connected units or nodes called ""artificial neurons"", which loosely model theneuronsin a biological brain."
188,"each connection, like thesynapsesin a biological brain, can transmit information, a ""signal"", from one artificial neuron to another."
189,an artificial neuron that receives a signal can process it and then signal additional artificial neurons connected to it.
190,"in common ann implementations, the signal at a connection between artificial neurons is areal number, and the output of each artificial neuron is computed by some non-linear function of the sum of its inputs."
191,"the connections between artificial neurons are called ""edges""."
192,artificial neurons and edges typically have aweightthat adjusts as learning proceeds.
193,the weight increases or decreases the strength of the signal at a connection.
194,artificial neurons may have a threshold such that the signal is only sent if the aggregate signal crosses that threshold.
195,"typically, artificial neurons are aggregated into layers."
196,different layers may perform different kinds of transformations on their inputs.
197,"signals travel from the first layer (the input layer) to the last layer (the output layer), possibly after traversing the layers multiple times.the original goal of the ann approach was to solve problems in the same way that ahuman brainwould."
198,"however, over time, attention moved to performing specific tasks, leading to deviations frombiology."
199,"artificial neural networks have been used on a variety of tasks, includingcomputer vision,speech recognition,machine translation,social networkfiltering,playing board and video gamesandmedical diagnosis.deep learningconsists of multiple hidden layers in an artificial neural network."
200,this approach tries to model the way the human brain processes light and sound into vision and hearing.
201,some successful applications of deep learning are computer vision and speech recognition.
202,decision treesmain article:decision tree learninga decision tree showing survival probability of passengers on thetitanicdecision tree learning uses adecision treeas apredictive modelto go from observations about an item (represented in the branches) to conclusions about the item's target value (represented in the leaves).
203,"it is one of the predictive modelling approaches used in statistics, data mining, and machine learning."
204,"tree models where the target variable can take a discrete set of values are called classification trees; in these tree structures,leavesrepresent class labels, and branches representconjunctionsof features that lead to those class labels."
205,decision trees where the target variable can take continuous values (typicallyreal numbers) are called regression trees.
206,"in decision analysis, a decision tree can be used to visually and explicitly represent decisions anddecision making."
207,"in data mining, a decision tree describes data, but the resulting classification tree can be an input for decision-making.random forest regressionrandom forest regression(rfr) falls under the umbrella of decisiontree-based models."
208,rfr is an ensemble learning method that builds multiple decision trees and averages their predictions to improve accuracy and to avoid overfitting.
209,"to build decision trees, rfr uses bootstrapped sampling; for instance, each decision tree is trained on random data from the training set."
210,this random selection of rfr for training enables the model to reduce biased predictions and achieve a higher degree of accuracy.
211,"rfr generates independent decision trees, and it can work on single-output data as well as multiple regressor tasks."
212,this makes rfr compatible to be use in various applications.
213,"support-vector machinesmain article:support-vector machinesupport-vector machines (svms), also known as support-vector networks, are a set of relatedsupervised learningmethods used for classification and regression."
214,"given a set of training examples, each marked as belonging to one of two categories, an svm training algorithm builds a model that predicts whether a new example falls into one category."
215,"an svm training algorithm is a non-probabilistic,binary,linear classifier, although methods such asplatt scalingexist to use svm in a probabilistic classification setting."
216,"in addition to performing linear classification, svms can efficiently perform a non-linear classification using what is called thekernel trick, implicitly mapping their inputs into high-dimensional feature spaces.regression analysismain article:regression analysisillustration of linear regression on a data setregression analysis encompasses a large variety of statistical methods to estimate the relationship between input variables and their associated features."
217,"its most common form islinear regression, where a single line is drawn to best fit the given data according to a mathematical criterion such asordinary least squares."
218,"the latter is often extended byregularisationmethods to mitigate overfitting and bias, as inridge regression."
219,"when dealing with non-linear problems, go-to models includepolynomial regression(for example, used for trendline fitting in microsoft excel),logistic regression(often used instatistical classification) or evenkernel regression, which introduces non-linearity by taking advantage of thekernel trickto implicitly map input variables to higher-dimensional space.multivariate linear regressionextends the concept of linear regression to handle multiple dependent variables simultaneously."
220,this approach estimates the relationships between a set of input variables and several output variables by fitting amultidimensionallinear model.
221,"it is particularly useful in scenarios where outputs are interdependent or share underlying patterns, such as predicting multiple economic indicators or reconstructing images,which are inherently multi-dimensional.bayesian networksmain article:bayesian networka simple bayesian network."
222,"rain influences whether the sprinkler is activated, and both rain and the sprinkler influence whether the grass is wet.a bayesian network, belief network, or directed acyclic graphical model is a probabilisticgraphical modelthat represents a set ofrandom variablesand theirconditional independencewith adirected acyclic graph(dag)."
223,"for example, a bayesian network could represent the probabilistic relationships between diseases and symptoms."
224,"given symptoms, the network can be used to compute the probabilities of the presence of various diseases."
225,efficient algorithms exist that performinferenceand learning.
226,"bayesian networks that model sequences of variables, likespeech signalsorprotein sequences, are calleddynamic bayesian networks."
227,"generalisations of bayesian networks that can represent and solve decision problems under uncertainty are calledinfluence diagrams.gaussian processesmain article:gaussian processesan example of gaussian process regression (prediction) compared with other regression modelsa gaussian process is astochastic processin which every finite collection of the random variables in the process has amultivariate normal distribution, and it relies on a pre-definedcovariance function, or kernel, that models how pairs of points relate to each other depending on their locations.given a set of observed points, or input–output examples, the distribution of the (unobserved) output of a new point as a function of its input data can be directly computed by looking at the observed points and the covariances between those points and the new, unobserved point.gaussian processes are popular surrogate models inbayesian optimisationused to dohyperparameter optimisation.genetic algorithmsmain article:genetic algorithma genetic algorithm (ga) is asearch algorithmandheuristictechnique that mimics the process ofnatural selection, using methods such asmutationandcrossoverto generate newgenotypesin the hope of finding good solutions to a given problem."
228,"in machine learning, genetic algorithms were used in the 1980s and 1990s."
229,"conversely, machine learning techniques have been used to improve the performance of genetic andevolutionary algorithms."
230,"belief functionsmain article:dempster–shafer theorythe theory of belief functions, also referred to as evidence theory or dempster–shafer theory, is a general framework for reasoning with uncertainty, with understood connections to other frameworks such asprobability,possibilityandimprecise probability theories."
231,"these theoretical frameworks can be thought of as a kind of learner and have some analogous properties of how evidence is combined (e.g., dempster's rule of combination), just like how in apmf-based bayesian approach would combine probabilities."
232,"however, there are many caveats to these beliefs functions when compared to bayesian approaches to incorporate ignorance anduncertainty quantification."
