,Text
0,"machine learning - wikipediajump to contentmain menumain menumove to sidebarhidenavigationmain pagecontentscurrent eventsrandom articleabout wikipediacontact uscontributehelplearn to editcommunity portalrecent changesupload filespecial pagessearchsearchappearancedonatecreate accountlog inpersonal toolsdonatecreate accountlog incontentsmove to sidebarhide(top)1history2relationships to other fieldstoggle relationships to other fields subsection2.1artificial intelligence2.2data compression2.3data mining2.4generalization2.5statistics2.6statistical physics3theory4approachestoggle approaches subsection4.1supervised learning4.2unsupervised learning4.2.1dimensionality reduction4.3semi-supervised learning4.4reinforcement learning4.5other types4.5.1self-learning4.5.2feature learning4.5.3sparse dictionary learning4.5.4anomaly detection4.5.5robot learning4.5.6association rules5modelstoggle models subsection5.1artificial neural networks5.2decision trees5.3random forest regression5.4support-vector machines5.5regression analysis5.6bayesian networks5.7gaussian processes5.8genetic algorithms5.9belief functions5.10rule-based models5.11training models5.11.1federated learning6applications7limitationstoggle limitations subsection7.1explainability7.2overfitting7.3other limitations and vulnerabilities8model assessments9ethicstoggle ethics subsection9.1bias9.2financial incentives10hardwaretoggle hardware subsection10.1tensor processing units (tpus)10.2neuromorphic computing10.2.1physical neural networks10.3embedded machine learning11softwaretoggle software subsection11.1free and open-source software11.2proprietary software with free and open-source editions11.3proprietary software12journals13conferences14see also15references16sources17further reading18external linkstoggle the table of contentsmachine learning88 languagesafrikaansالعربيةالدارجةঅসমীয়াazərbaycancaتۆرکجهбашҡортсабеларускаябългарскиभोजपुरीবাংলাབོད་ཡིགbosanskicatalàکوردیčeštinacymraegdanskdeutschελληνικάesperantoespañoleestieuskaraفارسیsuomivõrofrançaisgalegogaelgעבריתहिन्दीmagyarհայերենbahasa indonesiaidoíslenskaitaliano日本語jawaქართულიqaraqalpaqshaಕನ್ನಡ한국어кыргызчаligurelietuviųlatviešuмакедонскиമലയാളംмонголमराठीbahasa melayunederlandsnorsk nynorsknorsk bokmåloccitanଓଡ଼ିଆਪੰਜਾਬੀpolskiپنجابیپښتوportuguêsruna simiromânăрусскийᱥᱟᱱᱛᱟᱲᱤsrpskohrvatski / српскохрватскиsimple englishslovenščinashqipсрпски / srpskisvenskaதமிழ்తెలుగుไทยtagalogtürkçeئۇيغۇرچە / uyghurcheукраїнськаاردوoʻzbekcha / ўзбекчаtiếng việt吴语閩南語 / bân-lâm-gí粵語中文isizuluedit linksarticletalkenglishreadeditview historytoolstoolsmove to sidebarhideactionsreadeditview historygeneralwhat links hererelated changesupload filepermanent linkpage informationcite this pageget shortened urlprint/exportdownload as pdfprintable versionin other projectswikimedia commonswikiquotewikiversitywikidata itemappearancemove to sidebarhidefrom wikipedia, the free encyclopediastudy of algorithms that improve automatically through experiencefor the journal, seemachine learning (journal)."
1,"""statistical learning"" redirects here."
2,"for statistical learning in linguistics, seestatistical learning in language acquisition.part of a series onmachine learninganddata miningparadigmssupervised learningunsupervised learningsemi-supervised learningself-supervised learningreinforcement learningmeta-learningonline learningbatch learningcurriculum learningrule-based learningneuro-symbolic aineuromorphic engineeringquantum machine learningproblemsclassificationgenerative modelingregressionclusteringdimensionality reductiondensity estimationanomaly detectiondata cleaningautomlassociation rulessemantic analysisstructured predictionfeature engineeringfeature learninglearning to rankgrammar inductionontology learningmultimodal learningsupervised learning(classification•regression)apprenticeship learningdecision treesensemblesbaggingboostingrandom forestk-nnlinear regressionnaive bayesartificial neural networkslogistic regressionperceptronrelevance vector machine (rvm)support vector machine (svm)clusteringbirchcurehierarchicalk-meansfuzzyexpectation–maximization (em)dbscanopticsmean shiftdimensionality reductionfactor analysisccaicaldanmfpcapgdt-snesdlstructured predictiongraphical modelsbayes netconditional random fieldhidden markovanomaly detectionransack-nnlocal outlier factorisolation forestneural networksautoencoderdeep learningfeedforward neural networkrecurrent neural networklstmgruesnreservoir computingboltzmann machinerestrictedgandiffusion modelsomconvolutional neural networku-netlenetalexnetdeepdreamneural fieldneural radiance fieldphysics-informed neural networkstransformervisionmambaspiking neural networkmemtransistorelectrochemical ram(ecram)reinforcement learningq-learningpolicy gradientsarsatemporal difference (td)multi-agentself-playlearning with humansactive learningcrowdsourcinghuman-in-the-loopmechanistic interpretabilityrlhfmodel diagnosticscoefficient of determinationconfusion matrixlearning curveroc curvemathematical foundationskernel machinesbias–variance tradeoffcomputational learning theoryempirical risk minimizationoccam learningpac learningstatistical learningvc theorytopological deep learningjournals and conferencesaaaiecml pkddneuripsicmliclrijcaimljmlrrelated articlesglossary of artificial intelligencelist of datasets for machine-learning researchlist of datasets in computer vision and image processingoutline of machine learningvtepart ofa seriesonartificial intelligence (ai)major goalsartificial general intelligenceintelligent agentrecursive self-improvementplanningcomputer visiongeneral game playingknowledge representationnatural language processingroboticsai safetyapproachesmachine learningsymbolicdeep learningbayesian networksevolutionary algorithmshybrid intelligent systemssystems integrationopen-sourceai data centersapplicationsbioinformaticsdeepfakeearth sciencesfinancegenerative aiartaudiomusicgovernmenthealthcaremental healthindustrysoftware developmenttranslationmilitaryphysicsprojectsphilosophyai alignmentartificial consciousnessthe bitter lessonchinese roomfriendly aiethicsexistential riskturing testuncanny valleyhuman–ai interactionhistorytimelineprogressai winterai boomai bubblecontroversiesdeepfake pornographytaylor swift deepfake pornography controversygrok sexual deepfake scandalgoogle gemini image generation controversypause giant ai experimentsremoval of sam altman from openaistatement on ai risktay (chatbot)théâtre d'opéra spatialvoiceverse nft plagiarism scandalglossaryglossaryvtemachine learning(ml) is afield of studyinartificial intelligenceconcerned with the development and study ofstatistical algorithmsthat can learn fromdataandgeneralizeto unseen data, and thus performtaskswithout explicitinstructions."
3,"within a subdiscipline of machine learning, advances in the field ofdeep learninghave allowedneural networks, a class of statistical algorithms, to surpass many previous machine learning approaches in performance.ml finds applications in many fields, includingnatural language processing,computer vision,speech recognition,email filtering,agriculture, andmedicine."
4,"the application of ml to business problems is known aspredictive analytics.statisticsandmathematical optimisation(mathematical programming) methods compose the foundations of machine learning.data miningis a related field of study, focusing onexploratory data analysis(eda) throughunsupervised learning."
5,"from a theoretical viewpoint,probably approximately correct learningprovides a mathematical and statistical framework for describing machine learning."
6,"most traditional machine learning and deep learning algorithms can be described asempirical risk minimisationunder this framework.historysee also:timeline of machine learningthe termmachine learningwas coined in 1959 byarthur samuel, anibmemployee and pioneer in the field ofcomputer gamingandartificial intelligence."
7,the synonymself-teaching computerswas also used during this time period.
8,"the earliest machine learning program was introduced in the 1950s whenarthur samuelinvented acomputer programthat calculated the winning chance in checkers for each side, but the history of machine learning roots back to decades of human desire and effort to study human cognitive processes."
9,"in 1949, canadian psychologistdonald hebbpublished the bookthe organization of behavior, in which he introduced atheoretical neural structureformed by certain interactions amongnerve cells."
10,"hebb's modelofneuronsinteracting with one another set a groundwork for how ais and machine learning algorithms work under nodes, orartificial neuronsused by computers to communicate data."
11,"other researchers who have studied humancognitive systemscontributed to the modern machine learning technologies as well, including logicianwalter pittsandwarren mcculloch, who proposed the early mathematical models of neural networks to come up withalgorithmsthat mirror human thought processes."
12,"by the early 1960s, an experimental ""learning machine"" withpunched tapememory, called cybertron, had been developed byraytheon companyto analysesonarsignals,electrocardiograms, and speech patterns using rudimentaryreinforcement learning."
13,"it was repetitively ""trained"" by a human operator/teacher to recognise patterns and equipped with a ""goof"" button to cause it to reevaluate incorrect decisions."
14,"a representative book on research into machine learning during the 1960s wasnils nilsson's book on learning machines, dealing mostly with machine learning for pattern classification."
15,"interest related to pattern recognition continued into the 1970s, as described by duda and hart in 1973."
16,"in 1981, a report was given on using teaching strategies so that anartificial neural networklearns to recognise 40 characters (26 letters, 10 digits, and 4 special symbols) from a computer terminal."
17,"tom m. mitchellprovided a widely quoted, more formal definition of the algorithms studied in the machine learning field: ""a computer program is said to learn from experienceewith respect to some class of taskstand performance measurepif its performance at tasks int, as measured byp, improves with experiencee."
18,"""this definition of the tasks in which machine learning is concerned offers a fundamentallyoperational definitionrather than defining the field in cognitive terms."
19,"this followsalan turing's proposal in his paper ""computing machinery and intelligence"", in which the question, ""can machines think?"
20,""", is replaced with the question, ""can machines do what we (as thinking entities) can do?""."
21,"modern-day machine learning algorithms are broken into 3 algorithm types: supervised learning algorithms, unsupervised learning algorithms, and reinforcement learning algorithms."
22,"current supervised learning algorithms have objectives of classification and regression.current unsupervised learning algorithms have objectives of clustering, dimensionality reduction, and association rule.current reinforcement learning algorithms focus on decisions that must be made with respect to some previous, unknown time and are broken down to either be studies of model-based methods or model-free methods.in 2014 ian goodfellow and others introduced generative adversarial networks (gans) with realistic data synthesis."
23,by 2016 alphago obtained victory against top human players using reinforcement learning techniques.
24,"relationships to other fieldsartificial intelligencedeep learningis a subset of machine learning, which is itself a subset ofartificial intelligence."
25,"as a scientific endeavour, machine learning grew out of the quest forartificial intelligence(ai)."
26,"in the early days of ai as anacademic discipline, some researchers were interested in having machines learn from data."
27,"they attempted to approach the problem with various symbolic methods, as well as what were then termed ""neural networks""; these were mostlyperceptronsandother modelsthat were later found to be reinventions of thegeneralised linear modelsof statistics."
28,"probabilistic reasoningwas also employed, especially inautomated medical diagnosis."
29,": 488however, an increasing emphasis on thelogical, knowledge-based approachcaused a rift between ai and machine learning."
30,probabilistic systems were plagued by theoretical and practical problems of data acquisition and representation.
31,": 488by 1980,expert systemshad come to dominate ai, and statistics was out of favour."
32,"work on symbolic/knowledge-based learning did continue within ai, leading toinductive logic programming(ilp), but the more statistical line of research was now outside the field of ai proper, inpattern recognitionandinformation retrieval."
33,": 708–710, 755neural networks research had been abandoned by ai andcomputer sciencearound the same time."
34,"this line, too, was continued outside the ai/cs field, as ""connectionism"", by researchers from other disciplines, includingjohn hopfield,david rumelhart, andgeoffrey hinton."
35,their main success came in the mid-1980s with the reinvention ofbackpropagation.
36,": 25machine learning (ml), reorganised and recognised as its own field, started to flourish in the 1990s."
37,the field changed its goal from achieving artificial intelligence to tackling solvable problems of a practical nature.
38,"it shifted focus away from thesymbolic approachesit had inherited from ai, and toward methods and models borrowed from statistics,fuzzy logic, andprobability theory."
39,data compressionthis section is an excerpt fromdata compression § machine learning.
40,there is a close connection between machine learning and compression.
41,a system that predicts theposterior probabilitiesof a sequence given its entire history can be used for optimal data compression (by usingarithmetic codingon the output distribution).
42,"conversely, an optimal compressor can be used for prediction (by finding the symbol that compresses best, given the previous history)."
43,"this equivalence has been used as a justification for using data compression as a benchmark for ""general intelligence""."
44,"an alternative view can show compression algorithms implicitly map strings into implicitfeature space vectors, and compression-based similarity measures compute similarity within these feature spaces."
45,for each compressor c(.)
46,"we define an associated vector space ℵ, such that c(.)"
47,"maps an input string x, corresponding to the vector norm ||~x||."
48,"an exhaustive examination of the feature spaces underlying all compression algorithms is precluded by space; instead, feature vectors chooses to examine three representative lossless compression methods, lzw, lz77, and ppm."
49,"according toaixitheory, a connection more directly explained inhutter prize, the best possible compression of x is the smallest possible software that generates x."
50,"for example, in that model, a zip file's compressed size includes both the zip file and the unzipping software, since you can not unzip it without both, but there may be an even smaller combined form.examples of ai-powered audio/video compression software includenvidia maxine, aivc."
51,"examples of software that can perform ai-powered image compression includeopencv,tensorflow,matlab's image processing toolbox (ipt) and high-fidelity generative image compression."
52,"inunsupervised machine learning,k-means clusteringcan be utilized to compress data by grouping similar data points into clusters."
53,this technique simplifies handling extensive datasets that lack predefined labels and finds widespread use in fields such asimage compression.
54,"data compression aims to reduce the size of data files, enhancing storage efficiency and speeding up data transmission."
55,"k-means clustering, an unsupervised machine learning algorithm, is employed to partition a dataset into a specified number of clusters, k, each represented by thecentroidof its points."
56,this process condenses extensive datasets into a more compact set of representative points.
57,"particularly beneficial inimageandsignal processing, k-means clustering aids in data reduction by replacing groups of data points with their centroids, thereby preserving the core information of the original data while significantly decreasing the required storage space."
58,"large language models(llms) are also efficient lossless data compressors on some data sets, as demonstrated bydeepmind's research with the chinchilla 70b model."
59,"developed by deepmind, chinchilla 70b effectively compressed data, outperforming conventional methods such asportable network graphics(png) for images andfree lossless audio codec(flac) for audio."
60,"it achieved compression of image and audio data to 43.4% and 16.4% of their original sizes, respectively."
61,"there is, however, some reason to be concerned that the data set used for testing overlaps the llm training data set, making it possible that the chinchilla 70b model is only an efficient compression tool on data it has already been trained on."
62,"data miningmachine learning anddata miningoften employ the same methods and overlap significantly, but while machine learning focuses on prediction, based onknownproperties learned from the training data, data mining focuses on thediscoveryof (previously)unknownproperties in the data (this is the analysis step ofknowledge discoveryin databases)."
63,"data mining uses many machine learning methods, but with different goals; on the other hand, machine learning also employs data mining methods as ""unsupervised learning"" or as a preprocessing step to improve learner accuracy."
64,"much of the confusion between these two research communities (which do often have separate conferences and separate journals,ecml pkddbeing a major exception) comes from the basic assumptions they work with: in machine learning, performance is usually evaluated with respect to the ability toreproduce knownknowledge, while in knowledge discovery and data mining (kdd) the key task is the discovery of previouslyunknownknowledge."
65,"evaluated with respect to known knowledge, an uninformed (unsupervised) method will easily be outperformed by other supervised methods, while in a typical kdd task, supervised methods cannot be used due to the unavailability of training data."
66,[citation needed]machine learning also has intimate ties tooptimisation: many learning problems are formulated as minimisation of someloss functionon a training set of examples.
67,"loss functions express the discrepancy between the predictions of the model being trained and the actual problem instances (for example, in classification, one wants to assign alabelto instances, and models are trained to correctly predict the preassigned labels of a set of examples)."
68,"generalizationcharacterizing the generalisation of various learning algorithms is an active topic of current research, especially fordeep learningalgorithms.statisticsmachine learning andstatisticsare closely related fields in terms of methods, but distinct in their principal goal: statistics draws populationinferencesfrom asample, while machine learning finds generalisable predictive patterns."
69,conventional statistical analyses require the a priori selection of a model most suitable for the study data set.
70,"in addition, only significant or theoretically relevant variables based on previous experience are included for analysis."
71,"in contrast, machine learning is not built on a pre-structured model; rather, the data shape the model by detecting underlying patterns."
72,"the more variables (input) used to train the model, the more accurate the ultimate model will be."
73,"leo breimandistinguished two statistical modelling paradigms: data model and algorithmic model,wherein ""algorithmic model"" means more or less the machine learning algorithms likerandom forest.some statisticians have adopted methods from machine learning, leading to a combined field that they callstatistical learning."
74,"statistical physicsanalytical and computational techniques derived from deep-rooted physics of disordered systems can be extended to large-scale problems, including machine learning, e.g., to analyse the weight space ofdeep neural networks."
75,statistical physics is thus finding applications in the area ofmedical diagnostics.
76,theorymain articles:computational learning theoryandstatistical learning theorya core objective of a learner is to generalise from its experience.
77,"generalization in this context is the ability of a learning machine to perform accurately on new, unseen examples/tasks after having experienced a learning data set."
78,the training examples come from some generally unknown probability distribution (considered representative of the space of occurrences) and the learner has to build a general model about this space that enables it to produce sufficiently accurate predictions in new cases.the computational analysis of machine learning algorithms and their performance is a branch oftheoretical computer scienceknown ascomputational learning theoryvia theprobably approximately correct learningmodel.
79,"because training sets are finite and the future is uncertain, learning theory usually does not yield guarantees of the performance of algorithms."
80,"instead, probabilistic bounds on the performance are quite common."
81,"thebias–variance decompositionis one way to quantify generalisationerror.for the best performance in the context of generalisation, the complexity of the hypothesis should match the complexity of the function underlying the data."
82,"if the hypothesis is less complex than the function, then the model has underfitted the data."
83,"if the complexity of the model is increased in response, then the training error decreases."
84,"but if the hypothesis is too complex, then the model is subject tooverfittingand generalisation will be poorer."
85,"in addition to performance bounds, learning theorists study the time complexity and feasibility of learning."
86,"in computational learning theory, a computation is considered feasible if it can be done inpolynomial time."
87,there are two kinds oftime complexityresults: positive results show that a certain class of functions can be learned in polynomial time.
88,"negative results show that certain classes cannot be learned in polynomial time.approachesinsupervised learning, the training data is labelled with the expected answers, while inunsupervised learning, the model identifies patterns or structures in unlabelled data.machine learning approaches are traditionally divided into three broad categories, which correspond to learning paradigms, depending on the nature of the ""signal"" or ""feedback"" available to the learning system:supervised learning: the computer is presented with example inputs and their desired outputs, given by a ""teacher"", and the goal is to learn a general rule thatmapsinputs to outputs.unsupervised learning: no labels are given to the learning algorithm, leaving it on its own to find structure in its input."
89,unsupervised learning can be a goal in itself (discovering hidden patterns in data) or a means towards an end (feature learning).reinforcement learning: a computer program interacts with a dynamic environment in which it must perform a certain goal (such asdriving a vehicleor playing a game against an opponent).
90,"as it navigates its problem space, the program is provided feedback that's analogous to rewards, which it tries to maximise."
91,"although each algorithm has advantages and limitations, no single algorithm works for all problems."
92,supervised learningmain article:supervised learningasupport-vector machineis a supervised learning model that divides the data into regions separated by alinear boundary.
93,"here, the linear boundary divides the black circles from the white.supervised learning algorithms build a mathematical model of a set of data that contains both the inputs and the desired outputs."
94,"the data, known astraining data, consists of a set of training examples."
95,"each training example has one or more inputs and the desired output, also known as a supervisory signal."
96,"in the mathematical model, each training example is represented by anarrayor vector, sometimes called afeature vector, and the training data is represented by amatrix."
97,"throughiterative optimisationof anobjective function, supervised learning algorithms learn a function that can be used to predict the output associated with new inputs."
98,an optimal function allows the algorithm to correctly determine the output for inputs that were not a part of the training data.
99,an algorithm that improves the accuracy of its outputs or predictions over time is said to have learned to perform that task.
100,"types of supervised-learning algorithms includeactive learning,classificationandregression."
101,"classification algorithms are used when the outputs are restricted to a limited set of values, while regression algorithms are used when the outputs can take any numerical value within a range."
102,"for example, in a classification algorithm that filters emails, the input is an incoming email, and the output is the folder in which to file the email."
103,"in contrast, regression is used for tasks such as predicting a person's height based on factors like age and genetics or forecasting future temperatures based on historical data."
